"Key","Item Type","Publication Year","Author","Title","Publication Title","ISBN","ISSN","DOI","Url","Abstract Note","Date","Date Added","Date Modified","Access Date","Pages","Num Pages","Issue","Volume","Number Of Volumes","Journal Abbreviation","Short Title","Series","Series Number","Series Text","Series Title","Publisher","Place","Language","Rights","Type","Archive","Archive Location","Library Catalog","Call Number","Extra","Notes","File Attachments","Link Attachments","Manual Tags","Automatic Tags","Editor","Series Editor","Translator","Contributor","Attorney Agent","Book Author","Cast Member","Commenter","Composer","Cosponsor","Counsel","Interviewer","Producer","Recipient","Reviewed Author","Scriptwriter","Words By","Guest","Number","Edition","Running Time","Scale","Medium","Artwork Size","Filing Date","Application Number","Assignee","Issuing Authority","Country","Meeting Name","Conference Name","Court","References","Reporter","Legal Status","Priority Numbers","Programming Language","Version","System","Code","Code Number","Section","Session","Committee","History","Legislative Body"
"VNNKZQAI","journalArticle","2016","Seessle, J.; Gotthardt, D. N.; Schafer, M.; Gohdes, A.; Pfeiffenberger, J.; Ferenci, P.; Stremmel, W.; Weiss, K. H.","Concomitant immune-related events in Wilson disease: implications for monitoring chelator therapy","Journal of Inherited Metabolic Disease","","1573-2665","10.1007/s10545-015-9866-0","http://ovidsp.ovid.com/ovidweb.cgi?T=JS&CSC=Y&NEWS=N&PAGE=fulltext&D=med8&AN=26067812 http://sfx.metabib.ch/sfx_locater?sid=OVID:medline&id=pmid:26067812&id=doi:10.1007%2Fs10545-015-9866-0&issn=0141-8955&isbn=&volume=39&issue=1&spage=125&pages=125-30&date=2016&title=Journal+of+Inherited+Metabolic+Disease&atitle=Concomitant+immune-related+events+in+Wilson+disease%3A+implications+for+monitoring+chelator+therapy.&aulast=Seessle&pid=%3Cauthor%3ESeessle+J%3BGotthardt+DN%3BSchafer+M%3BGohdes+A%3BPfeiffenberger+J%3BFerenci+P%3BStremmel+W%3BWeiss+KH%3C%2Fauthor%3E%3CAN%3E26067812%3C%2FAN%3E%3CDT%3EJournal+Article%3C%2FDT%3E https://link.springer.com/content/pdf/10.1007%2Fs10545-015-9866-0.pdf","BACKGROUND AND AIMS: Current guidelines favor the use of chelating agents (d-penicillamine, trientine) in first line therapy of symptomatic Wilson disease patients. Development of chelator induced immunological adverse events are a concern especially under d-penicillamine therapy. This study assessed the prevalence of co-existing or therapy-related immune-mediated diseases in Wilson disease patients, and evaluated the role of antinuclear antibodies in therapy monitoring. METHODS: We retrospectively analyzed 235 Wilson disease patients. Medical regimens were classified and analyzed in relation to adverse events and antinuclear antibody courses. RESULTS: Coexisting immune-mediated diseases were evident in 19/235 (8.1%) patients, of which 13/235 (5.5%) had pre-existing autoimmune diseases. Six patients (2.6%) developed an autoimmune disease under therapy, all of them under long-term d-penicillamine treatment. Data relating to antinuclear antibody courses during treatment and adverse events were available for patients treated with d-penicillamine (n=91), trientine (n=58), and zinc salts (n=58). No significant increase in antinuclear antibody titers in patients treated with d-penicillamine (16/91; 17.6%), trientine (12/58; 20.7%), and zinc (7/58; 12.1%) were found. CONCLUSION: Under long-term d-penicillamine therapy a minority of patients developed immune-mediated disease. Elevations in antinuclear antibodies were found frequently, but no correlations were evident between increases in antinuclear antibodies and the development of immune-mediated diseases or medical regimes. Thus, the value of antinuclear antibodies for monitoring adverse events under chelator therapy seems to be limited.","2016-01","2020-02-20 10:16:09","2020-02-20 10:16:09","","125-30","","1","39","","J Inherit Metab Dis","","","","","","","","English","","","MEDLINE","26067812","Ovid Technologies","","","","","","*Chelating Agents/ae [Adverse Effects]; *Chelating Agents/tu [Therapeutic Use]; *Drug-Related Side Effects and Adverse Reactions/im [Immunology]; *Hepatolenticular Degeneration/dt [Drug Therapy]; *Hepatolenticular Degeneration/im [Immunology]; 0 (Antibodies, Antinuclear); 0 (Chelating Agents); Adolescent; Adult; Antibodies, Antinuclear/im [Immunology]; Autoimmune Diseases/ci [Chemically Induced]; Autoimmune Diseases/im [Immunology]; Child; Cross-Sectional Studies; Drug Monitoring/mt [Methods]; Female; GNN1DV99GX (Penicillamine); Humans; J41CSQ7QDS (Zinc); Male; Penicillamine/ae [Adverse Effects]; Penicillamine/im [Immunology]; Penicillamine/tu [Therapeutic Use]; Retrospective Studies; SJ76Y07H5F (Trientine); Trientine/ae [Adverse Effects]; Trientine/im [Immunology]; Trientine/tu [Therapeutic Use]; Young Adult; Zinc/ae [Adverse Effects]; Zinc/im [Immunology]; Zinc/tu [Therapeutic Use]","","","","","","","","","","","","","","","","","","","","","","","","","","","","","","","","","","","","","","","","","","","","","","",""
"8PXYFPCC","journalArticle","2015","Litwin, T.; Dziezyc, K.; Karlinski, M.; Chabik, G.; Czepiel, W.; Czlonkowska, A.","Early neurological worsening in patients with Wilson's disease","Journal of the Neurological Sciences","","1878-5883","10.1016/j.jns.2015.06.010","http://ovidsp.ovid.com/ovidweb.cgi?T=JS&CSC=Y&NEWS=N&PAGE=fulltext&D=med8&AN=26071888 http://sfx.metabib.ch/sfx_locater?sid=OVID:medline&id=pmid:26071888&id=doi:10.1016%2Fj.jns.2015.06.010&issn=0022-510X&isbn=&volume=355&issue=1&spage=162&pages=162-7&date=2015&title=Journal+of+the+Neurological+Sciences&atitle=Early+neurological+worsening+in+patients+with+Wilson%27s+disease.&aulast=Litwin&pid=%3Cauthor%3ELitwin+T%3BDziezyc+K%3BKarlinski+M%3BChabik+G%3BCzepiel+W%3BCzlonkowska+A%3C%2Fauthor%3E%3CAN%3E26071888%3C%2FAN%3E%3CDT%3EJournal+Article%3C%2FDT%3E","BACKGROUND: Early neurological worsening during treatment initiation for Wilson's disease (WD) is an unresolved problem. Our aim was to establish the frequency and outcome of early neurological worsening in patients with WD. METHODS: We analyzed 143 symptomatic patients diagnosed with WD between 2005 and 2009. Early neurological deterioration was based on worsening on the Unified Wilson's Disease Score Scale, scored at baseline through 6 months or occurrence of new neurological symptoms. Reversibility of worsening was followed up to 24 months. RESULTS: Early neurological worsening was observed in 11.1% (16/143) and involved only patients with neurological signs at diagnosis. Mean time to worsening from treatment initiation was 2.3 +/- 1.9 months. Neurological deterioration was completely reversible in 53% (8/15) and partially in 13% (2/15) of patients over 9.2 +/- 5.2 months. Patients who experienced early deterioration had significantly more severe baseline neurological deficit, higher prevalence of thalamic (66% vs 29%) and brain stem (73% vs 33%) lesions seen on baseline magnetic resonance imaging, and more often used concomitant dopamine receptor antagonists (46% vs 5%). Disease duration, treatment type (d-penicillamine or zinc sulfate), type of neurological manifestations, initial copper metabolism results, and liver function parameters did not differ between evaluated groups. CONCLUSIONS: Neurological worsening at the beginning of anti-copper therapy may occur in over 10% of WD patients. Special attention should be paid to those with severe initial neurological manifestations, advanced brain injury and using dopamine receptor antagonists. Type of anti-copper therapy did not show clear association with early neurological worsening. Copyright © 2015 Elsevier B.V. All rights reserved.","2015-08-15","2020-02-20 10:16:09","2020-02-20 10:16:09","","162-7","","1-2","355","","J Neurol Sci","","","","","","","","English","","","MEDLINE","26071888","Ovid Technologies","","","","","","*Hepatolenticular Degeneration/co [Complications]; *Nervous System Diseases/et [Etiology]; 0 (Dopamine Agents); 789U1901C5 (Copper); Adolescent; Adult; Brain/pa [Pathology]; Copper/me [Metabolism]; Dopamine Agents/tu [Therapeutic Use]; Female; Follow-Up Studies; Hepatolenticular Degeneration/dt [Drug Therapy]; Humans; Magnetic Resonance Imaging; Male; Nervous System Diseases/di [Diagnosis]; Nervous System Diseases/dt [Drug Therapy]; Neurologic Examination; Retrospective Studies; Treatment Outcome; Young Adult","","","","","","","","","","","","","","","","","","","","","","","","","","","","","","","","","","","","","","","","","","","","","","",""
"MPMTAEPG","journalArticle","2014","Ranucci, G.; Di Dato, F.; Spagnuolo, M. I.; Vajro, P.; Iorio, R.","Zinc monotherapy is effective in Wilson's disease patients with mild liver disease diagnosed in childhood: a retrospective study","Orphanet Journal Of Rare Diseases","","1750-1172","10.1186/1750-1172-9-41","http://ovidsp.ovid.com/ovidweb.cgi?T=JS&CSC=Y&NEWS=N&PAGE=fulltext&D=med8&AN=24661374 http://sfx.metabib.ch/sfx_locater?sid=OVID:medline&id=pmid:24661374&id=doi:10.1186%2F1750-1172-9-41&issn=1750-1172&isbn=&volume=9&issue=&spage=41&pages=41&date=2014&title=Orphanet+Journal+Of+Rare+Diseases&atitle=Zinc+monotherapy+is+effective+in+Wilson%27s+disease+patients+with+mild+liver+disease+diagnosed+in+childhood%3A+a+retrospective+study.&aulast=Ranucci&pid=%3Cauthor%3ERanucci+G%3BDi+Dato+F%3BSpagnuolo+MI%3BVajro+P%3BIorio+R%3C%2Fauthor%3E%3CAN%3E24661374%3C%2FAN%3E%3CDT%3EJournal+Article%3C%2FDT%3E https://www.ncbi.nlm.nih.gov/pmc/articles/PMC4234980/pdf/1750-1172-9-41.pdf","BACKGROUND: Wilson's disease (WD) evolves rapidly and is fatal if untreated. The treatment of WD patients with mild liver disease is not clearly defined. To address this issue, we evaluated long-term outcomes of three treatment regimens (D-penicillamine, zinc or both) in patients diagnosed in childhood. METHODS: We retrospectively evaluated efficacy, compliance and reasons for treatment discontinuation in 42 WD patients (median age at diagnosis: 6 years; median follow-up: 12 years) with mild liver disease. Treatment duration for each treatment block until a medication change or completion of follow-up was analyzed. Events of change of treatment were evaluated using Kaplan-Meier analysis. RESULTS: Total discontinuations due to treatment failure or adverse events were more frequent in patients receiving D-penicillamine (45%) or combination (36%) therapy than in patients receiving zinc (12%) (P = .001 and P = .02, respectively). Treatment failure was more frequent on D-penicillamine (28%) and combination therapy (36%) than on zinc (12%); the difference was statistically significant only between zinc and combination therapy (P = .03). First-line zinc monotherapy controlled WD-related liver disease in 13/15 patients (87%); the two subjects that failed on zinc were poor adherent. Zinc was effective in 3/5 (60%) patients that failed on D-penicillamine and combination regimens. All 15 D-penicillamine responders that switched to zinc had good control of liver disease at a median follow-up of 13.1 years. Among 6 D-penicillamine non-responders that switched to zinc, 4 (67%) responded. At follow-up completion, only 5/42 (12%) patients failed. Adverse event-induced discontinuation was significantly more frequent in patients on D-penicillamine than in patients receiving zinc (P = .03). CONCLUSIONS: Zinc monotherapy is effective in controlling WD-related liver disease both as first-line and as maintenance treatment in patients with mild liver disease diagnosed in childhood.","2014-03-25","2020-02-20 10:16:10","2020-02-20 10:16:10","","41","","","9","","Orphanet J Rare Dis","","","","","","","","English","","","MEDLINE","24661374","Ovid Technologies","","","","","","*Hepatolenticular Degeneration/dt [Drug Therapy]; *Liver Diseases/dt [Drug Therapy]; *Zinc/tu [Therapeutic Use]; 0 (Cation Transport Proteins); Adenosine Triphosphatases; Cation Transport Proteins; EC 3-6-1 (Adenosine Triphosphatases); EC 3-6-3-4 (Wilson disease protein); Female; Humans; J41CSQ7QDS (Zinc); Male; Retrospective Studies","","","","","","","","","","","","","","","","","","","","","","","","","","","","","","","","","","","","","","","","","","","","","","",""
"BRX65CYP","journalArticle","2014","Czlonkowska, A.; Litwin, T.; Karlinski, M.; Dziezyc, K.; Chabik, G.; Czerska, M.","D-penicillamine versus zinc sulfate as first-line therapy for Wilson's disease","European Journal of Neurology","","1468-1331","10.1111/ene.12348","http://ovidsp.ovid.com/ovidweb.cgi?T=JS&CSC=Y&NEWS=N&PAGE=fulltext&D=med8&AN=24447648 http://sfx.metabib.ch/sfx_locater?sid=OVID:medline&id=pmid:24447648&id=doi:10.1111%2Fene.12348&issn=1351-5101&isbn=&volume=21&issue=4&spage=599&pages=599-606&date=2014&title=European+Journal+of+Neurology&atitle=D-penicillamine+versus+zinc+sulfate+as+first-line+therapy+for+Wilson%27s+disease.&aulast=Czlonkowska&pid=%3Cauthor%3ECzlonkowska+A%3BLitwin+T%3BKarlinski+M%3BDziezyc+K%3BChabik+G%3BCzerska+M%3C%2Fauthor%3E%3CAN%3E24447648%3C%2FAN%3E%3CDT%3EComparative+Study%3C%2FDT%3E http://onlinelibrary.wiley.com/store/10.1111/ene.12348/asset/ene12348.pdf?v=1&t=jbf4y1p6&s=51574445a86126759d8b10a17f1016bb9336bfde","BACKGROUND AND PURPOSE: To compare the course of treatment in patients with symptomatic Wilson's disease (WD) receiving either D-penicillamine (DPA) or zinc sulfate (ZS) as first-line therapy. METHODS: In all, 143 consecutive patients diagnosed with symptomatic WD from January 2005 to December 2009, followed until December 2010, were included. The decision about first-line therapy was made individually after discussion with the patient. Physicians had no clear preference of one drug over the other. Data were analyzed in subgroups with predominantly neurological (DPA, 35; ZS, 21) and hepatic (DPA, 36; ZS, 51) presentation of WD. RESULTS: According to Kaplan-Meier analysis, neurological WD patients scheduled for DPA had a similar probability of not remaining on first-line therapy as patients receiving ZS (20% vs. 24% at the end of follow-up), with adjusted odds ratio (OR) of 0.9 (95% CI 0.2-3.5). In patients with hepatic WD, this probability was significantly higher for DPA (31% vs. 12%; adjusted OR 3.0, 95% CI 0.9-9.9), especially in the first 6 months. Early worsening occurred only in neurological WD patients, with no differences between both treatment groups (35% vs. 19%; OR 2.8, 95% CI 0.7-10.8). Neurological improvement and decrease of liver enzymes were achieved with similar frequency. Compliance with DPA was better in hepatic (97% vs. 80%) but not in neurological patients (91% vs. 81%). Drug adverse effects were more common on DPA (15% vs. 3%). CONCLUSIONS: DPA and ZS are effective in the majority of WD patients. Neither therapy appears to be clearly superior. Therefore ZS may be considered a reasonable alternative to DPA as a first-line therapy. Copyright © 2014 The Author(s) European Journal of Neurology © 2014 EFNS.","2014-04","2020-02-20 10:16:10","2020-02-20 10:16:10","","599-606","","4","21","","Eur J Neurol","","","","","","","","English","","","MEDLINE","24447648","Ovid Technologies","","","","","","*Antirheumatic Agents/tu [Therapeutic Use]; *Hepatolenticular Degeneration/dt [Drug Therapy]; *Penicillamine/tu [Therapeutic Use]; *Zinc Sulfate/tu [Therapeutic Use]; 0 (Antirheumatic Agents); 7733-02-0 (Zinc Sulfate); Adult; Female; Follow-Up Studies; GNN1DV99GX (Penicillamine); Hepatolenticular Degeneration/cl [Classification]; Hepatolenticular Degeneration/pp [Physiopathology]; Humans; Kaplan-Meier Estimate; Male; Neurologic Examination; Odds Ratio; Patient Compliance; Probability; Retrospective Studies; Treatment Outcome","","","","","","","","","","","","","","","","","","","","","","","","","","","","","","","","","","","","","","","","","","","","","","",""
"3SXDH77T","journalArticle","2013","Sini, M.; Sorbello, O.; Sanna, F.; Battolu, F.; Civolani, A.; Fanni, D.; Faa, G.; Demelia, L.","Histologic evolution and long-term outcome of Wilson's disease: results of a single-center experience","European Journal of Gastroenterology & Hepatology","","1473-5687","10.1097/MEG.0b013e328358f7da","http://ovidsp.ovid.com/ovidweb.cgi?T=JS&CSC=Y&NEWS=N&PAGE=fulltext&D=med8&AN=23011036 http://sfx.metabib.ch/sfx_locater?sid=OVID:medline&id=pmid:23011036&id=doi:10.1097%2FMEG.0b013e328358f7da&issn=0954-691X&isbn=&volume=25&issue=1&spage=111&pages=111-7&date=2013&title=European+Journal+of+Gastroenterology+%26+Hepatology&atitle=Histologic+evolution+and+long-term+outcome+of+Wilson%27s+disease%3A+results+of+a+single-center+experience.&aulast=Sini&pid=%3Cauthor%3ESini+M%3BSorbello+O%3BSanna+F%3BBattolu+F%3BCivolani+A%3BFanni+D%3BFaa+G%3BDemelia+L%3C%2Fauthor%3E%3CAN%3E23011036%3C%2FAN%3E%3CDT%3EJournal+Article%3C%2FDT%3E","BACKGROUND/AIMS: Wilson's disease (WD) is a rare inborn disease related to copper storage, leading to liver cirrhosis and neuropsychological deterioration. The aim of this study was to determine the clinical presentation and long-term outcome, and to examine the progression of hepatic histopathology in serial liver biopsies from WD patients. MATERIALS AND METHODS: We carried out a retrospective analysis of 60 patients with WD treated with zinc and/or penicillamine. Demographic, clinical, and laboratory data were gathered and 40 patients underwent an initial biopsy and at least one repeat biopsy. Patients were divided into two groups: progressors (patients who presented worsening of at least one unit of fibrosis) and nonprogressors (patients who presented stable or improved fibrosis scores). RESULTS: A total of 33/40 (83%) patients (nonprogressors) showed stable hepatic histology or improvement. Seven of 40 (17%) patients (progressors) showed worsening of fibrosis. There was no significant correlation between the histological findings and clinical parameters or initial presentation. CONCLUSION: In our study cohort, liver disease was stable or improving in most of the patients, and development of progressive hepatic symptoms while under treatment was a rare event. The development of new symptoms while under treatment or progression of pre-existing symptoms was more often recorded for neurological than for hepatic symptoms.","2013-01","2020-02-20 10:16:10","2020-02-20 10:16:10","","111-7","","1","25","","Eur J Gastroenterol Hepatol","","","","","","","","English","","","MEDLINE","23011036","Ovid Technologies","","","","","","*Hepatolenticular Degeneration/pa [Pathology]; *Liver Cirrhosis/pa [Pathology]; *Liver/pa [Pathology]; 0 (Chelating Agents); 7733-02-0 (Zinc Sulfate); Adolescent; Adult; Biopsy; Chelating Agents/tu [Therapeutic Use]; Chi-Square Distribution; Child; Child, Preschool; Disease Progression; Female; GNN1DV99GX (Penicillamine); Hepatolenticular Degeneration/co [Complications]; Hepatolenticular Degeneration/dt [Drug Therapy]; Humans; Italy; Liver Cirrhosis/dt [Drug Therapy]; Liver Cirrhosis/et [Etiology]; Liver/de [Drug Effects]; Male; Middle Aged; Penicillamine/tu [Therapeutic Use]; Retrospective Studies; SJ76Y07H5F (Trientine); Time Factors; Treatment Outcome; Trientine/tu [Therapeutic Use]; Young Adult; Zinc Sulfate/tu [Therapeutic Use]","","","","","","","","","","","","","","","","","","","","","","","","","","","","","","","","","","","","","","","","","","","","","","",""
"UK7KYVRP","journalArticle","2005","Czlonkowska, A.; Tarnacka, B.; Litwin, T.; Gajda, J.; Rodo, M.","Wilson's disease-cause of mortality in 164 patients during 1992-2003 observation period","Journal of Neurology","","0340-5354","10.1007/s00415-005-0720-4","http://ovidsp.ovid.com/ovidweb.cgi?T=JS&CSC=Y&NEWS=N&PAGE=fulltext&D=medc&AN=15742108 http://sfx.metabib.ch/sfx_locater?sid=OVID:medline&id=pmid:15742108&id=doi:10.1007%2Fs00415-005-0720-4&issn=0340-5354&isbn=&volume=252&issue=6&spage=698&pages=698-703&date=2005&title=Journal+of+Neurology&atitle=Wilson%27s+disease-cause+of+mortality+in+164+patients+during+1992-2003+observation+period.&aulast=Czlonkowska&pid=%3Cauthor%3ECzlonkowska+A%3BTarnacka+B%3BLitwin+T%3BGajda+J%3BRodo+M%3C%2Fauthor%3E%3CAN%3E15742108%3C%2FAN%3E%3CDT%3EComparative+Study%3C%2FDT%3E https://link.springer.com/content/pdf/10.1007%2Fs00415-005-0720-4.pdf","We studied the cause of death in a consecutive series of 164 patients with Wilson's disease (WD) diagnosed over an 11 year period. A total of 20 [12% (95% CI 10.3-16.0)] died during the observation period. The relative survival rate of all patients in our group was statistically smaller than in Polish population. The main cause of death was the diagnosis in advanced stage of disease, but in six patients presenting with mild signs, we observed the progression of the disease despite treatment. There was no difference in mortality rate in patients treated with d-penicillamine or zinc sulphate as initial therapy. The prognosis for survival in the majority of WD patients is favourable, provided that therapy is introduced early.","2005-06","2020-02-20 10:16:10","2020-02-20 10:16:10","","698-703","","6","252","","J Neurol","","","","","","","","English","","","MEDLINE","15742108","Ovid Technologies","","","","","","*Hepatolenticular Degeneration/mo [Mortality]; *Observation/mt [Methods]; 7733-02-0 (Zinc Sulfate); 789U1901C5 (Copper); Adult; Brain/de [Drug Effects]; Brain/me [Metabolism]; Brain/pa [Pathology]; Confidence Intervals; Copper/me [Metabolism]; Disease Progression; Female; GNN1DV99GX (Penicillamine); Hepatolenticular Degeneration/dt [Drug Therapy]; Hepatolenticular Degeneration/ep [Epidemiology]; Humans; Male; Penicillamine/tu [Therapeutic Use]; Retrospective Studies; Survival Rate; Treatment Outcome; Zinc Sulfate/tu [Therapeutic Use]","","","","","","","","","","","","","","","","","","","","","","","","","","","","","","","","","","","","","","","","","","","","","","",""
"NB4XM4SE","journalArticle","1996","Czlonkowska, A.; Gajda, J.; Rodo, M.","Effects of long-term treatment in Wilson's disease with D-penicillamine and zinc sulphate","Journal of Neurology","","0340-5354","","http://ovidsp.ovid.com/ovidweb.cgi?T=JS&CSC=Y&NEWS=N&PAGE=fulltext&D=medc&AN=8936358 http://sfx.metabib.ch/sfx_locater?sid=OVID:medline&id=pmid:8936358&id=doi:&issn=0340-5354&isbn=&volume=243&issue=3&spage=269&pages=269-73&date=1996&title=Journal+of+Neurology&atitle=Effects+of+long-term+treatment+in+Wilson%27s+disease+with+D-penicillamine+and+zinc+sulphate.&aulast=Czlonkowska&pid=%3Cauthor%3ECzlonkowska+A%3BGajda+J%3BRodo+M%3C%2Fauthor%3E%3CAN%3E8936358%3C%2FAN%3E%3CDT%3EClinical+Trial%3C%2FDT%3E https://link.springer.com/content/pdf/10.1007%2FBF00868525.pdf","The results of treatment with D-penicillamine (D-P) or zinc sulphate (Zn) in 67 newly diagnosed cases of Wilson's disease have been compared. All patients (7 with hepatic, 1 with psychiatric and 59 with neurological or preclinical forms) were fully compliant. During 12 years of observation, 34 patients received d-P and 33 Zn as the primary treatment. Fifteen patients (44%) discontinued D-P, in 10 cases owing to side effects. Four (12%) patients discontinued Zn, in 2 cases because of side-effects. One patient who received Zn deteriorated during the first few months after the initiation of therapy. The effectiveness of long-term treatment with D-P and Zn was similar in those patients who were able to continue the initial therapy. Zn was tolerated better than D-P; we suggest, therefore, that it may be recommended as an initial therapy for patients in the preclinical stage of Wilson's disease or with neurological presentation of the disease. More observation is needed for patients with the hepatic and psychiatric forms of the disease.","1996-03","2020-02-20 10:16:11","2020-02-20 10:16:11","","269-73","","3","243","","J Neurol","","","","","","","","English","","","MEDLINE","8936358","Ovid Technologies","","","","","","*Hepatolenticular Degeneration/dt [Drug Therapy]; *Penicillamine/tu [Therapeutic Use]; *Zinc Sulfate/tu [Therapeutic Use]; 7733-02-0 (Zinc Sulfate); Adult; GNN1DV99GX (Penicillamine); Humans; Patient Compliance; Time Factors; Treatment Outcome","","","","","","","","","","","","","","","","","","","","","","","","","","","","","","","","","","","","","","","","","","","","","","",""
