"KFJ77U72","journalArticle","2012","Rodriguez, B.; Burguera, J.; Berenguer, M.","Response to different therapeutic approaches in Wilson disease. A long-term follow up study","Annals of Hepatology","","1665-2681","","http://ovidsp.ovid.com/ovidweb.cgi?T=JS&CSC=Y&NEWS=N&PAGE=fulltext&D=med7&AN=23109455 http://sfx.metabib.ch/sfx_locater?sid=OVID:medline&id=pmid:23109455&id=doi:&issn=1665-2681&isbn=&volume=11&issue=6&spage=907&pages=907-14&date=2012&title=Annals+of+Hepatology&atitle=Response+to+different+therapeutic+approaches+in+Wilson+disease.+A+long-term+follow+up+study.&aulast=Rodriguez&pid=%3Cauthor%3ERodriguez+B%3BBurguera+J%3BBerenguer+M%3C%2Fauthor%3E%3CAN%3E23109455%3C%2FAN%3E%3CDT%3EJournal+Article%3C%2FDT%3E","BACKGROUND AND AIMS: There are certain areas of uncertainty regarding the best therapeutic approach in patients diagnosed with Wilson Disease (WD). Our aim was to assess treatment response to different therapies in a cohort of WD patients followed in a single center. MATERIAL AND METHODS: This is an observational, descriptive study in which clinical, laboratory and imaging data are reviewed in a series of 20 WD patients with a median follow-up of 14 years. Type of presentation, treatment used, biochemical and copper homeostasis parameters were elicited. RESULTS: Median age at diagnosis was 22 years. The most frequent form of presentation was hepatic (n = 10, 50%; mean age: 21.5 years), followed by neurological (25%; mean age: 34.5 years) and mixed (15%). The initial treatment in both symptomatic and asymptomatic patients at diagnosis was d-penicillamine in 90% and Zinc (Zn) in 10%, respectively. Patients who were maintained on d-penicillamine for the whole period had complete biochemical normalization (baseline ALT: 220 IU/l; last follow up 38 IU/l). In contrast, patients in whom d-penicillamine was switched to Zn, irrespective of the cause, did not show a complete biochemical remission (baseline ALT: 100 IU/l vs. 66 IU/l at last follow-up). CONCLUSIONS: Treatment was found to be effective in most cases regardless of the drug used. However, side effects were common in those treated with d-penicillamine agents, and required switching to zinc. Therapy with zinc was well tolerated and appeared to have a good efficacy. However, in 33%, a complete normalization of liver enzymes was never reached.","2012-11","2020-02-20 10:16:11","2020-02-20 10:16:11","","907-14","","6","11","","Ann Hepatol","","","","","","","","English","","","MEDLINE","23109455","Ovid Technologies","","","","","","*Chelating Agents/tu [Therapeutic Use]; *Copper/bl [Blood]; *Hepatolenticular Degeneration/dt [Drug Therapy]; *Penicillamine/tu [Therapeutic Use]; *Zinc/tu [Therapeutic Use]; 0 (Biomarkers); 0 (Chelating Agents); 789U1901C5 (Copper); Adolescent; Adult; Biomarkers/bl [Blood]; Chelating Agents/ae [Adverse Effects]; Child; Drug Substitution; Female; Follow-Up Studies; GNN1DV99GX (Penicillamine); Hepatolenticular Degeneration/bl [Blood]; Hepatolenticular Degeneration/di [Diagnosis]; Humans; J41CSQ7QDS (Zinc); Male; Middle Aged; Penicillamine/ae [Adverse Effects]; Retrospective Studies; Spain; Time Factors; Treatment Outcome; Young Adult; Zinc/ae [Adverse Effects]","","","","","","","","","","","","","","","","","","","","","","","","","","","","","","","","","","","","","","","","","","","","","","",""
"79AIUCLX","journalArticle","2011","Bruha, R.; Marecek, Z.; Pospisilova, L.; Nevsimalova, S.; Vitek, L.; Martasek, P.; Nevoral, J.; Petrtyl, J.; Urbanek, P.; Jiraskova, A.; Ferenci, P.","Long-term follow-up of Wilson disease: natural history, treatment, mutations analysis and phenotypic correlation","Liver International","","1478-3231","10.1111/j.1478-3231.2010.02354.x","http://ovidsp.ovid.com/ovidweb.cgi?T=JS&CSC=Y&NEWS=N&PAGE=fulltext&D=med7&AN=20958917 http://sfx.metabib.ch/sfx_locater?sid=OVID:medline&id=pmid:20958917&id=doi:10.1111%2Fj.1478-3231.2010.02354.x&issn=1478-3223&isbn=&volume=31&issue=1&spage=83&pages=83-91&date=2011&title=Liver+International&atitle=Long-term+follow-up+of+Wilson+disease%3A+natural+history%2C+treatment%2C+mutations+analysis+and+phenotypic+correlation.&aulast=Bruha&pid=%3Cauthor%3EBruha+R%3BMarecek+Z%3BPospisilova+L%3BNevsimalova+S%3BVitek+L%3BMartasek+P%3BNevoral+J%3BPetrtyl+J%3BUrbanek+P%3BJiraskova+A%3BFerenci+P%3C%2Fauthor%3E%3CAN%3E20958917%3C%2FAN%3E%3CDT%3EJournal+Article%3C%2FDT%3E http://onlinelibrary.wiley.com/store/10.1111/j.1478-3231.2010.02354.x/asset/j.1478-3231.2010.02354.x.pdf?v=1&t=jbf4ytx2&s=1390586f41336783c89c56d098bfcd8ac49b3f53","BACKGROUND AND AIMS: Wilson disease (WD) is an inherited disorder of copper metabolism. When treated, the outcome can be excellent, although the long-term survival has yet to be well documented. The aim of this study was to describe the long-term outcome of a cohort of patients with WD and to assess those factors affecting the phenotypic manifestation of WD. METHODS: The presence of mutations to the ATP7B gene, the clinical manifestations, treatments and the long-term outcomes were analysed retrospectively in 117 patients with WD (59 men and 58 women, aged at evaluation 38.5 +/- 11, range 16-63 years). RESULTS: Fifty-five patients with a neurological presentation, 51 patients with a hepatic presentation and 11 asymptomatic patients were followed up for an average of 15.1 +/- 10 years (median 12 years, range 1-41 years). The H1069Q ATP7B gene mutation was the most frequent genetic variant (54.3%); the frequency of this mutation did not differ between patients with either the hepatic or the neurological presentation (P = 0.099). d-penicillamine or zinc salts (81 and 17% respectively) were used for treatment, and three patients underwent liver transplantation. The majority of symptomatic patients became asymptomatic, or improved, during the follow-up (82% patients with hepatic presentation, 69% with neurological presentation). The long-term survival of patients with WD did not differ from that of the general Czech population (P = 0.95). CONCLUSIONS: Long-term follow-up shows a satisfactory response in the great majority of adequately treated patients with WD and survival coincides with that of the general population. Copyright © 2010 John Wiley & Sons A/S.","2011-01","2020-02-20 10:16:11","2020-02-20 10:16:11","","83-91","","1","31","","Liver Int","","","","","","","","English","","","MEDLINE","20958917","Ovid Technologies","","","","","","*Adenosine Triphosphatases/ge [Genetics]; *Cation Transport Proteins/ge [Genetics]; *Copper/me [Metabolism]; *Hepatolenticular Degeneration/ge [Genetics]; *Mutation; 0 (Cation Transport Proteins); 0 (Chelating Agents); 7733-02-0 (Zinc Sulfate); 789U1901C5 (Copper); Adenosine Triphosphatases/me [Metabolism]; Adolescent; Adult; Asymptomatic Diseases; Cation Transport Proteins/me [Metabolism]; Chelating Agents/me [Metabolism]; Chi-Square Distribution; Czech Republic; Disease Progression; DNA Mutational Analysis; EC 3-6-1 (Adenosine Triphosphatases); EC 3-6-3-4 (Wilson disease protein); Female; FM5526K07A (Zinc Acetate); Gene Frequency; Genetic Predisposition to Disease; GNN1DV99GX (Penicillamine); Hepatolenticular Degeneration/en [Enzymology]; Hepatolenticular Degeneration/mo [Mortality]; Hepatolenticular Degeneration/th [Therapy]; Humans; Kaplan-Meier Estimate; Liver Transplantation; Male; Middle Aged; Penicillamine/tu [Therapeutic Use]; Phenotype; Retrospective Studies; Time Factors; Treatment Outcome; Young Adult; Zinc Acetate/tu [Therapeutic Use]; Zinc Sulfate/tu [Therapeutic Use]","","","","","","","","","","","","","","","","","","","","","","","","","","","","","","","","","","","","","","","","","","","","","","",""
"TYFWIJNB","journalArticle","2010","Cope-Yokoyama, S.; Finegold, M. J.; Sturniolo, G. C.; Kim, K.; Mescoli, C.; Rugge, M.; Medici, V.","Wilson disease: histopathological correlations with treatment on follow-up liver biopsies","World Journal of Gastroenterology","","2219-2840","","http://ovidsp.ovid.com/ovidweb.cgi?T=JS&CSC=Y&NEWS=N&PAGE=fulltext&D=med6&AN=20333789 http://sfx.metabib.ch/sfx_locater?sid=OVID:medline&id=pmid:20333789&id=doi:&issn=1007-9327&isbn=&volume=16&issue=12&spage=1487&pages=1487-94&date=2010&title=World+Journal+of+Gastroenterology&atitle=Wilson+disease%3A+histopathological+correlations+with+treatment+on+follow-up+liver+biopsies.&aulast=Cope-Yokoyama&pid=%3Cauthor%3ECope-Yokoyama+S%3BFinegold+MJ%3BSturniolo+GC%3BKim+K%3BMescoli+C%3BRugge+M%3BMedici+V%3C%2Fauthor%3E%3CAN%3E20333789%3C%2FAN%3E%3CDT%3EJournal+Article%3C%2FDT%3E https://www.ncbi.nlm.nih.gov/pmc/articles/PMC2846254/pdf/WJG-16-1487.pdf","AIM: To investigate the progression of hepatic histopathology in serial liver biopsies from Wilson disease (WD) patients. METHODS: We report a group of 12 WD patients treated with zinc and/or penicillamine who underwent multiple follow-up liver biopsies. Demographic, clinical and laboratory data were gathered and all patients underwent an initial biopsy and at least one repeat biopsy. RESULTS: Time to repeat biopsy ranged from 2 to 12 years. Six patients (non-progressors) showed stable hepatic histology or improvement. In one case, we observed improvement of fibrosis from stage 2 to 0. Six patients (progressors) had worsening of fibrosis. There was no significant correlation between the histological findings and serum aminotransferases or copper metabolism parameters. The hepatic copper concentration reached normal levels in only two patients: one from the non-progressors and one from the progressors group. The estimated rate of progression of hepatic fibrosis in the entire group was 0 units per year in the time frame between the first and the second liver biopsy (4 years), and 0.25 between the second and the third (3 years). In the progressors group, the rate of progression of liver fibrosis was estimated at 0.11 fibrosis units per year between the first and second biopsy and, 0.6 fibrosis units between the second and third biopsy. CONCLUSION: The inability of clinical tools to detect fibrosis progression in WD suggests that a liver biopsy with hepatic copper quantification every 3 years should be considered.","2010-03-28","2020-02-20 10:16:12","2020-02-20 10:16:12","","1487-94","","12","16","","World J Gastroenterol","","","","","","","","English","","","MEDLINE","20333789","Ovid Technologies","","","","","","*Chelating Agents/tu [Therapeutic Use]; *Copper/me [Metabolism]; *Hepatolenticular Degeneration/dt [Drug Therapy]; *Liver Cirrhosis/dt [Drug Therapy]; *Liver/de [Drug Effects]; *Penicillamine/tu [Therapeutic Use]; *Zinc Sulfate/tu [Therapeutic Use]; 0 (Biomarkers); 0 (Chelating Agents); 7733-02-0 (Zinc Sulfate); 789U1901C5 (Copper); Adolescent; Adult; Alanine Transaminase/bl [Blood]; Aspartate Aminotransferases/bl [Blood]; Biomarkers/bl [Blood]; Biopsy; Child; Copper/ur [Urine]; EC 2-6-1-1 (Aspartate Aminotransferases); EC 2-6-1-2 (Alanine Transaminase); Female; GNN1DV99GX (Penicillamine); Hepatolenticular Degeneration/co [Complications]; Hepatolenticular Degeneration/me [Metabolism]; Hepatolenticular Degeneration/pa [Pathology]; Humans; Liver Cirrhosis/et [Etiology]; Liver Cirrhosis/me [Metabolism]; Liver Cirrhosis/pa [Pathology]; Liver/me [Metabolism]; Liver/pa [Pathology]; Male; Time Factors; Treatment Outcome; Young Adult","","","","","","","","","","","","","","","","","","","","","","","","","","","","","","","","","","","","","","","","","","","","","","",""
"UA96J9XJ","journalArticle","2009","Svetel, M.; Pekmezovic, T.; Petrovic, I.; Tomic, A.; Kresojevic, N.; Jesic, R.; Kazic, S.; Raicevic, R.; Stefanovic, D.; Delibasic, N.; Zivanovic, D.; Dordevic, M.; Kostic, V. S.","Long-term outcome in Serbian patients with Wilson disease","European Journal of Neurology","","1468-1331","10.1111/j.1468-1331.2009.02607.x","http://ovidsp.ovid.com/ovidweb.cgi?T=JS&CSC=Y&NEWS=N&PAGE=fulltext&D=med6&AN=19473354 http://sfx.metabib.ch/sfx_locater?sid=OVID:medline&id=pmid:19473354&id=doi:10.1111%2Fj.1468-1331.2009.02607.x&issn=1351-5101&isbn=&volume=16&issue=7&spage=852&pages=852-7&date=2009&title=European+Journal+of+Neurology&atitle=Long-term+outcome+in+Serbian+patients+with+Wilson+disease.&aulast=Svetel&pid=%3Cauthor%3ESvetel+M%3BPekmezovic+T%3BPetrovic+I%3BTomic+A%3BKresojevic+N%3BJesic+R%3BKazic+S%3BRaicevic+R%3BStefanovic+D%3BDelibasic+N%3BZivanovic+D%3BDordevic+M%3BKostic+VS%3C%2Fauthor%3E%3CAN%3E19473354%3C%2FAN%3E%3CDT%3EJournal+Article%3C%2FDT%3E http://onlinelibrary.wiley.com/store/10.1111/j.1468-1331.2009.02607.x/asset/j.1468-1331.2009.02607.x.pdf?v=1&t=jbf4z03v&s=7bf8120c2521a95898c0b0f3f1b444be35713b93","BACKGROUND AND PURPOSE: To investigate survival rates, prognostic factors, and causes of death in Wilson disease (WD). METHODS: In the years 1980-2007, a cohort of 142 patients with WD was prospectively registered (54 presented with neurologic symptoms, 49 with hepatic symptoms, 33 had mixed form, and data were missing for six patients). The duration of follow-up for patients alive was 11.1 +/- 8.8 years. RESULTS: After initiation of treatment (d-penicillamine and zinc salts), 79% of patients had a stable or improved course of disease. Despite early diagnosis and appropriate therapy, 15 patients still had a relentlessly progressive course. Thirty patients died. The cumulative probability of survival in a 15-year period for the whole group was 76.7 +/- 4.9%. Better prognosis of WD was associated with male sex, younger age at onset, neurologic form of the disease, and treatment continuity. Causes of death were predominantly related to hepatic failure (16 patients), but also suicide (four patients) and cancer (three patients). CONCLUSION: Despite the relatively early diagnosis and treatment of our patients with WD, mortality was still considerably high.","2009-07","2020-02-20 10:16:12","2020-02-20 10:16:12","","852-7","","7","16","","Eur J Neurol","","","","","","","","English","","","MEDLINE","19473354","Ovid Technologies","","","","","","*Hepatolenticular Degeneration/mo [Mortality]; *Hepatolenticular Degeneration/pp [Physiopathology]; 0 (Chelating Agents); Age of Onset; Cause of Death; Chelating Agents/tu [Therapeutic Use]; Cohort Studies; Female; GNN1DV99GX (Penicillamine); Hepatolenticular Degeneration/di [Diagnosis]; Hepatolenticular Degeneration/dt [Drug Therapy]; Humans; Male; Penicillamine/tu [Therapeutic Use]; Prognosis; Retrospective Studies; Serbia","","","","","","","","","","","","","","","","","","","","","","","","","","","","","","","","","","","","","","","","","","","","","","",""
"CHXX6R5C","journalArticle","2007","Merle, U.; Schaefer, M.; Ferenci, P.; Stremmel, W.","Clinical presentation, diagnosis and long-term outcome of Wilson's disease: a cohort study","Gut","","0017-5749","10.1136/gut.2005.087262","http://ovidsp.ovid.com/ovidweb.cgi?T=JS&CSC=Y&NEWS=N&PAGE=fulltext&D=med5&AN=16709660 http://sfx.metabib.ch/sfx_locater?sid=OVID:medline&id=pmid:16709660&id=doi:10.1136%2Fgut.2005.087262&issn=0017-5749&isbn=&volume=56&issue=1&spage=115&pages=115-20&date=2007&title=Gut&atitle=Clinical+presentation%2C+diagnosis+and+long-term+outcome+of+Wilson%27s+disease%3A+a+cohort+study.&aulast=Merle&pid=%3Cauthor%3EMerle+U%3BSchaefer+M%3BFerenci+P%3BStremmel+W%3C%2Fauthor%3E%3CAN%3E16709660%3C%2FAN%3E%3CDT%3EJournal+Article%3C%2FDT%3E https://www.ncbi.nlm.nih.gov/pmc/articles/PMC1856673/pdf/115.pdf","BACKGROUND: Wilson's disease is a rare inborn disease related to copper storage, leading to liver cirrhosis and neuropsychological deterioration. Clinical data on larger cohorts are limited owing to low disease frequency. OBJECTIVE AND METHODS: We performed a retrospective analysis of 163 patients with Wilson's disease, examined at the University of Heidelberg, Heidelberg, Germany, to determine clinical presentation, diagnostic course and long-term outcome. RESULTS: Diagnostic criteria for non-caeruloplasmin-bound serum copper, serum caeruloplasmin, 24-h urinary copper excretion, liver copper content, presence of Kayser-Fleischer rings and histological signs of chronic liver damage were reached in 86.6%, 88.2%, 87.1%, 92.7%, 66.3% and 73% of patients, respectively. By analysis of the coding region of ATP7B (except exons 2, 3 and 21), disease-causing mutations were detected in 57% and 29% of patients with Wilson's disease on both chromosomes and on one chromosome, respectively. No mutations were detected in 15% of patients with Wilson's disease. No significant differences were found in clinical parameters or initial presentation between patients grouped according to their mutations. The patients with neurological symptoms were significantly older at the onset of symptoms than patients with hepatitic symptoms (20.2 v 15.5 years of age, p<0.05), and the neurological symptoms were associated with a significantly longer time from onset to diagnosis than hepatic symptoms (44.4 v 14.4 months, p<0.05). After initiating treatment, 76.1% of the patients had a stable or improved course of the disease. Disease progression under treatment was more likely for neuropsychiatric than for hepatic symptoms. Side effects of treatment occurred in 74.4% of patients. CONCLUSIONS: Patients with Wilson's disease having predominantly neuropsychiatric symptoms manifest symptoms later, have a longer time delay from onset of symptoms until definitive diagnosis and have a poorer outcome than patients with hepatic symptoms.","2007-01","2020-02-20 10:16:12","2020-02-20 10:16:12","","115-20","","1","56","","Gut","","","","","","","","English","","","MEDLINE","16709660","Ovid Technologies","","","","","","*Hepatolenticular Degeneration/di [Diagnosis]; 0 (Cation Transport Proteins); 0 (Chelating Agents); 0 (Trace Elements); 789U1901C5 (Copper); Adenosine Triphosphatases/ge [Genetics]; Adolescent; Adult; Cation Transport Proteins/ge [Genetics]; Ceruloplasmin/an [Analysis]; Chelating Agents/tu [Therapeutic Use]; Child; Child, Preschool; Cohort Studies; Copper/bl [Blood]; Copper/ur [Urine]; DNA Mutational Analysis/mt [Methods]; EC 1-16-3-1 (Ceruloplasmin); EC 3-6-1 (Adenosine Triphosphatases); EC 3-6-3-4 (Wilson disease protein); Female; Genotype; GNN1DV99GX (Penicillamine); Hepatolenticular Degeneration/dt [Drug Therapy]; Hepatolenticular Degeneration/ge [Genetics]; Humans; Infant; J41CSQ7QDS (Zinc); Liver/me [Metabolism]; Liver/pa [Pathology]; Male; Middle Aged; Penicillamine/tu [Therapeutic Use]; Phenotype; Retrospective Studies; SJ76Y07H5F (Trientine); Trace Elements/tu [Therapeutic Use]; Treatment Outcome; Trientine/tu [Therapeutic Use]; Zinc/tu [Therapeutic Use]","","","","","","","","","","","","","","","","","","","","","","","","","","","","","","","","","","","","","","","","","","","","","","",""
"V97G72VW","journalArticle","2006","Medici, V.; Trevisan, C. P.; D'Inca, R.; Barollo, M.; Zancan, L.; Fagiuoli, S.; Martines, D.; Irato, P.; Sturniolo, G. C.","Diagnosis and management of Wilson's disease: results of a single center experience","Journal of Clinical Gastroenterology","","0192-0790","10.1097/01.mcg.0000225670.91722.59","http://ovidsp.ovid.com/ovidweb.cgi?T=JS&CSC=Y&NEWS=N&PAGE=fulltext&D=med5&AN=17063115 http://sfx.metabib.ch/sfx_locater?sid=OVID:medline&id=pmid:17063115&id=doi:10.1097%2F01.mcg.0000225670.91722.59&issn=0192-0790&isbn=&volume=40&issue=10&spage=936&pages=936-41&date=2006&title=Journal+of+Clinical+Gastroenterology&atitle=Diagnosis+and+management+of+Wilson%27s+disease%3A+results+of+a+single+center+experience.&aulast=Medici&pid=%3Cauthor%3EMedici+V%3BTrevisan+CP%3BD%27Inca+R%3BBarollo+M%3BZancan+L%3BFagiuoli+S%3BMartines+D%3BIrato+P%3BSturniolo+GC%3C%2Fauthor%3E%3CAN%3E17063115%3C%2FAN%3E%3CDT%3EJournal+Article%3C%2FDT%3E http://ovidsp.tx.ovid.com/ovftpdfs/FPDDNCIBGHCBIG00/fs047/ovft/live/gv031/00004836/00004836-200611000-00012.pdf","AIMS: To report on the diagnostic features, management, and clinical outcome after different treatments of Wilson's disease patients followed over a mean period of 15 years. PATIENTS: Thirty-five patients with Wilson's disease referred to the University of Padova's Department of Gastroenterology for diagnosis or treatment were observed for a mean 15 years. The diagnosis was based on clinical symptoms, laboratory tests (ceruloplasmin, urinary, and hepatic copper concentrations), and uptake of the radiostable isotope Cu into the plasma protein pool. Hepatic Cu content was measured by regular follow-up biopsies. Neurologic outcome after therapy was assessed using a newly developed scoring system. RESULTS: Twenty-three (65.7%) patients presented with liver disease; 12 (34.3%) had mixed neurologic and hepatic involvement. All patients had been initially treated with either penicillamine (23) or zinc sulfate (12). The neurologic symptoms became worse or remained stationary in 75% of those treated with penicillamine, whereas zinc treatment improved these symptoms in 90% of treated cases. Both treatments were effective in improving the hepatic symptoms. No differences in hepatic Cu content emerged between follow-up biopsies in either treatment group. Six patients (26%) had to abandon the penicillamine treatment due to side effects. In all, 4 patients underwent liver transplantation, which was successful in 3, with a mean survival after transplantation of 4.6 years; the fourth, who had a severe neurologic impairment, died of central pontine myelinolysis. CONCLUSIONS: Penicillamine and zinc can effectively treat Wilson's disease, though the side effects of penicillamine may be severe enough to prompt its suspension. Liver transplantation remains the treatment of choice for end-stage liver disease.","2006-11","2020-02-20 10:16:13","2020-02-20 10:16:13","","936-41","","10","40","","J Clin Gastroenterol","","","","","","","","English","","","MEDLINE","17063115","Ovid Technologies","","","","","","*Hepatolenticular Degeneration/di [Diagnosis]; *Hepatolenticular Degeneration/th [Therapy]; 0 (Biomarkers); 0 (Chelating Agents); 0 (Isotopes); 0 (Trace Elements); 789U1901C5 (Copper); Adolescent; Adult; Alanine Transaminase/bl [Blood]; Alanine Transaminase/de [Drug Effects]; Biomarkers/bl [Blood]; Biomarkers/ur [Urine]; Ceruloplasmin/de [Drug Effects]; Ceruloplasmin/me [Metabolism]; Chelating Agents/ad [Administration & Dosage]; Chelating Agents/ae [Adverse Effects]; Child; Child, Preschool; Copper/ur [Urine]; EC 1-16-3-1 (Ceruloplasmin); EC 2-6-1-2 (Alanine Transaminase); Female; Follow-Up Studies; GNN1DV99GX (Penicillamine); Hepatolenticular Degeneration/me [Metabolism]; Humans; Isotopes/ur [Urine]; Italy/ep [Epidemiology]; J41CSQ7QDS (Zinc); Liver Transplantation; Magnetic Resonance Imaging; Male; Penicillamine/ad [Administration & Dosage]; Penicillamine/ae [Adverse Effects]; Postoperative Complications/et [Etiology]; Postoperative Complications/mo [Mortality]; Severity of Illness Index; Survival Analysis; Tomography, X-Ray Computed; Trace Elements/tu [Therapeutic Use]; Treatment Outcome; Zinc/tu [Therapeutic Use]","","","","","","","","","","","","","","","","","","","","","","","","","","","","","","","","","","","","","","","","","","","","","","",""
