"MLTW79FR","journalArticle","2004","Kumagi, T.; Horiike, N.; Michitaka, K.; Hasebe, A.; Kawai, K.; Tokumoto, Y.; Nakanishi, S.; Furukawa, S.; Hiasa, Y.; Matsui, H.; Kurose, K.; Matsuura, B.; Onji, M.","Recent clinical features of Wilson's disease with hepatic presentation","Journal of Gastroenterology","","0944-1174","10.1007/s00535-004-1466-y","http://ovidsp.ovid.com/ovidweb.cgi?T=JS&CSC=Y&NEWS=N&PAGE=fulltext&D=med5&AN=15622480 http://sfx.metabib.ch/sfx_locater?sid=OVID:medline&id=pmid:15622480&id=doi:10.1007%2Fs00535-004-1466-y&issn=0944-1174&isbn=&volume=39&issue=12&spage=1165&pages=1165-9&date=2004&title=Journal+of+Gastroenterology&atitle=Recent+clinical+features+of+Wilson%27s+disease+with+hepatic+presentation.&aulast=Kumagi&pid=%3Cauthor%3EKumagi+T%3BHoriike+N%3BMichitaka+K%3BHasebe+A%3BKawai+K%3BTokumoto+Y%3BNakanishi+S%3BFurukawa+S%3BHiasa+Y%3BMatsui+H%3BKurose+K%3BMatsuura+B%3BOnji+M%3C%2Fauthor%3E%3CAN%3E15622480%3C%2FAN%3E%3CDT%3EJournal+Article%3C%2FDT%3E https://link.springer.com/content/pdf/10.1007%2Fs00535-004-1466-y.pdf","BACKGROUND: We carried out this study to evaluate recent clinical features of Wilson's disease (WD) with hepatic presentation, especially in terms of age, degree of liver injury, and association with hepatocellular carcinoma (HCC). METHODS: Sixteen patients with hepatic manifestations were diagnosed with WD in the period 1976-2003. We divided this period into two periods, ""past"" and ""recent"". The diagnosis was based on the presence of Kayser-Fleisher rings, low serum copper levels, low serum ceruloplasmin levels, increased urinary copper concentrations before or after D-penicillamine challenge, and increased hepatic copper concentrations. This retrospective study was done at Ehime University Hospital. RESULTS: Four patients, including a pair of siblings, had a family history of WD. Four patients had parental consanguinity. There were 6 patients aged over 40 years in the recent period, whereas no patients in the past period were over 40. Four patients had neurological manifestations. Ten patients had liver cirrhosis and 5 had chronic hepatitis. Two had fatty liver without obesity. All patients in the past period had liver cirrhosis. Three patients with liver cirrhosis were found to have HCC during the follow up. All patients were treated with either D-penicillamine or trientine chloride, or both. However, four patients had to discontinue these agents due to the side effects. CONCLUSIONS: Recently, the number of patients diagnosed with WD has been increasing, not only in terms of those with classical-type WD but also in terms of elderly patients or patients with non-cirrhotic liver injury such as fatty liver and chronic hepatitis. The various clinical features of WD should be recognized and particular attention should focus on HCC as a complication.","2004-12","2020-02-20 10:16:13","2020-02-20 10:16:13","","1165-9","","12","39","","J Gastroenterol","","","","","","","","English","","","MEDLINE","15622480","Ovid Technologies","","","","","","*Carcinoma, Hepatocellular/co [Complications]; *Hepatolenticular Degeneration/di [Diagnosis]; *Liver Neoplasms/co [Complications]; Adolescent; Adult; Aged; Carcinoma, Hepatocellular/ep [Epidemiology]; Child; Female; Hepatolenticular Degeneration/co [Complications]; Humans; Liver Diseases/ep [Epidemiology]; Liver Diseases/et [Etiology]; Liver Neoplasms/ep [Epidemiology]; Male; Middle Aged; Retrospective Studies","","","","","","","","","","","","","","","","","","","","","","","","","","","","","","","","","","","","","","","","","","","","","","",""
"CN8WFWN2","journalArticle","2001","Durand, F.; Bernuau, J.; Giostra, E.; Mentha, G.; Shouval, D.; Degott, C.; Benhamou, J. P.; Valla, D.","Wilson's disease with severe hepatic insufficiency: beneficial effects of early administration of D-penicillamine","Gut","","0017-5749","","http://ovidsp.ovid.com/ovidweb.cgi?T=JS&CSC=Y&NEWS=N&PAGE=fulltext&D=med4&AN=11358907 http://sfx.metabib.ch/sfx_locater?sid=OVID:medline&id=pmid:11358907&id=doi:&issn=0017-5749&isbn=&volume=48&issue=6&spage=849&pages=849-52&date=2001&title=Gut&atitle=Wilson%27s+disease+with+severe+hepatic+insufficiency%3A+beneficial+effects+of+early+administration+of+D-penicillamine.&aulast=Durand&pid=%3Cauthor%3EDurand+F%3BBernuau+J%3BGiostra+E%3BMentha+G%3BShouval+D%3BDegott+C%3BBenhamou+JP%3BValla+D%3C%2Fauthor%3E%3CAN%3E11358907%3C%2FAN%3E%3CDT%3EJournal+Article%3C%2FDT%3E","BACKGROUND: Wilson's disease, heralded by severe hepatic insufficiency, is a rare disorder for which emergency liver transplantation is considered to be the only effective therapy. AIMS: To report the features of Wilson's disease with severe hepatic insufficiency in a series of 17 patients and, during the second period of the study, to assess the efficacy of a policy consisting of early administration of D-penicillamine. PATIENTS: Seventeen consecutive patients with Wilson's disease were studied. During the first period of the study (up to 1979), none of the patients received D-penicillamine. During the second period (after 1979), all patients without encephalopathy at admission received D-penicillamine. RESULTS: The four patients observed during the first period who did not have encephalopathy at admission and did not receive D-penicillamine progressed to encephalopathy and died. Among the 13 consecutive patients observed during the second period, two patients with encephalopathy at admission did not receive D-penicillamine and were transplanted. The 11 remaining patients all received D-penicillamine. Ten of these patients survived without the need for transplantation and returned to compensated liver disease without liver insufficiency. In one patient, liver insufficiency progressed and transplantation had to be performed. CONCLUSIONS: In most patients with Wilson's disease heralded by severe hepatic insufficiency and without encephalopathy at admission, early administration of D-penicillamine was associated with survival without transplantation. These results suggest the importance of early diagnosis of this form of Wilson's disease before the onset of encephalopathy, and favour early administration of D-penicillamine which could avoid the need for transplantation in most cases.","2001-06","2020-02-20 10:16:13","2020-02-20 10:16:13","","849-52","","6","48","","Gut","","","","","","","","English","","","MEDLINE","11358907","Ovid Technologies","","","","","","*Chelating Agents/tu [Therapeutic Use]; *Hepatolenticular Degeneration/th [Therapy]; *Penicillamine/tu [Therapeutic Use]; 0 (Chelating Agents); Acute Kidney Injury/et [Etiology]; Acute Kidney Injury/th [Therapy]; Adolescent; Adult; Child; Female; GNN1DV99GX (Penicillamine); Hepatic Encephalopathy/et [Etiology]; Hepatolenticular Degeneration/co [Complications]; Hepatolenticular Degeneration/di [Diagnosis]; Humans; Liver Transplantation/mt [Methods]; Male; Patient Selection; Treatment Outcome","","","","","","","","","","","","","","","","","","","","","","","","","","","","","","","","","","","","","","","","","","","","","","",""
"QTEE3UEZ","journalArticle","1973","Strickland, G. T.; Frommer, D.; Leu, M. L.; Pollard, R.; Sherlock, S.; Cumings, J. N.","Wilson's disease in the United Kingdom and Taiwan. I. General characteristics of 142 cases and prognosis. II. A genetic analysis of 88 cases","Quarterly Journal of Medicine","","0033-5622","","http://ovidsp.ovid.com/ovidweb.cgi?T=JS&CSC=Y&NEWS=N&PAGE=fulltext&D=med1&AN=4199472 http://sfx.metabib.ch/sfx_locater?sid=OVID:medline&id=pmid:4199472&id=doi:&issn=0033-5622&isbn=&volume=42&issue=167&spage=619&pages=619-38&date=1973&title=Quarterly+Journal+of+Medicine&atitle=Wilson%27s+disease+in+the+United+Kingdom+and+Taiwan.+I.+General+characteristics+of+142+cases+and+prognosis.+II.+A+genetic+analysis+of+88+cases.&aulast=Strickland&pid=%3Cauthor%3EStrickland+GT%3BFrommer+D%3BLeu+ML%3BPollard+R%3BSherlock+S%3BCumings+JN%3C%2Fauthor%3E%3CAN%3E4199472%3C%2FAN%3E%3CDT%3EJournal+Article%3C%2FDT%3E","","1973-07","2020-02-20 10:16:13","2020-02-20 10:16:13","","619-38","","167","42","","Q J Med","","","","","","","","English","","","MEDLINE","4199472","Ovid Technologies","","","","","","*Hepatolenticular Degeneration; Adolescent; Adult; Age Factors; Child; Female; GNN1DV99GX (Penicillamine); Hepatolenticular Degeneration/dt [Drug Therapy]; Hepatolenticular Degeneration/ge [Genetics]; Hepatolenticular Degeneration/mo [Mortality]; Humans; Long-Term Care; Male; Middle Aged; Pedigree; Penicillamine/tu [Therapeutic Use]; Prognosis; Sex Factors; Taiwan; United Kingdom","","","","","","","","","","","","","","","","","","","","","","","","","","","","","","","","","","","","","","","","","","","","","","",""
"HQ2KGM6X","journalArticle","1968","Goldstein, N. P.; Tauxe, W. N.; McCall, J. T.; Randall, R. V.; Gross, J. B.","What Wilson's disease and its treatment have taught us about the metabolism of copper. Observations in 27 cases","Medical Clinics of North America","","0025-7125","","http://ovidsp.ovid.com/ovidweb.cgi?T=JS&CSC=Y&NEWS=N&PAGE=fulltext&D=med1&AN=5742073 http://sfx.metabib.ch/sfx_locater?sid=OVID:medline&id=pmid:5742073&id=doi:&issn=0025-7125&isbn=&volume=52&issue=4&spage=989&pages=989-1001&date=1968&title=Medical+Clinics+of+North+America&atitle=What+Wilson%27s+disease+and+its+treatment+have+taught+us+about+the+metabolism+of+copper.+Observations+in+27+cases.&aulast=Goldstein&pid=%3Cauthor%3EGoldstein+NP%3BTauxe+WN%3BMcCall+JT%3BRandall+RV%3BGross+JB%3C%2Fauthor%3E%3CAN%3E5742073%3C%2FAN%3E%3CDT%3EJournal+Article%3C%2FDT%3E","","1968-07","2020-02-20 10:16:14","2020-02-20 10:16:14","","989-1001","","4","52","","Med Clin North Am","","","","","","","","English","","","MEDLINE","5742073","Ovid Technologies","","","","","","*Copper/me [Metabolism]; *Hepatolenticular Degeneration/me [Metabolism]; 0 (Radioisotopes); 789U1901C5 (Copper); Adolescent; Adult; Biological Transport; Ceruloplasmin/bl [Blood]; Child; Child, Preschool; Diet Therapy; EC 1-16-3-1 (Ceruloplasmin); Female; GNN1DV99GX (Penicillamine); Hepatolenticular Degeneration/di [Diagnosis]; Hepatolenticular Degeneration/th [Therapy]; Humans; Liver/me [Metabolism]; Male; Middle Aged; Penicillamine/pd [Pharmacology]; Penicillamine/tu [Therapeutic Use]; Radioisotopes","","","","","","","","","","","","","","","","","","","","","","","","","","","","","","","","","","","","","","","","","","","","","","",""
"JBNEJ9CZ","journalArticle","1968","Sternlieb, I.; Scheinberg, I. H.","Prevention of Wilson's disease in asymptomatic patients","New England Journal of Medicine","","0028-4793","10.1056/NEJM196802152780702","http://ovidsp.ovid.com/ovidweb.cgi?T=JS&CSC=Y&NEWS=N&PAGE=fulltext&D=med1&AN=5635646 http://sfx.metabib.ch/sfx_locater?sid=OVID:medline&id=pmid:5635646&id=doi:10.1056%2FNEJM196802152780702&issn=0028-4793&isbn=&volume=278&issue=7&spage=352&pages=352-9&date=1968&title=New+England+Journal+of+Medicine&atitle=Prevention+of+Wilson%27s+disease+in+asymptomatic+patients.&aulast=Sternlieb&pid=%3Cauthor%3ESternlieb+I%3BScheinberg+IH%3C%2Fauthor%3E%3CAN%3E5635646%3C%2FAN%3E%3CDT%3EJournal+Article%3C%2FDT%3E","","1968-02-15","2020-02-20 10:16:14","2020-02-20 10:16:14","","352-9","","7","278","","N Engl J Med","","","","","","","","English","","","MEDLINE","5635646","Ovid Technologies","","","","","","*Hepatolenticular Degeneration/pc [Prevention & Control]; *Penicillamine/tu [Therapeutic Use]; 789U1901C5 (Copper); Adolescent; Adult; Biopsy; Ceruloplasmin/an [Analysis]; Child; Child, Preschool; Copper/an [Analysis]; EC 1-16-3-1 (Ceruloplasmin); Female; GNN1DV99GX (Penicillamine); Hepatolenticular Degeneration/bl [Blood]; Hepatolenticular Degeneration/di [Diagnosis]; Hepatolenticular Degeneration/ge [Genetics]; Hepatolenticular Degeneration/me [Metabolism]; Hepatolenticular Degeneration/pa [Pathology]; Humans; Infant; Liver/an [Analysis]; Liver/pa [Pathology]; Male; Microscopy, Electron","","","","","","","","","","","","","","","","","","","","","","","","","","","","","","","","","","","","","","","","","","","","","","",""
"W3FEYCA5","journalArticle","2013","Weiss, K. H.; Thurik, F.; Gotthardt, D. N.; Schafer, M.; Teufel, U.; Wiegand, F.; Merle, U.; Ferenci-Foerster, D.; Maieron, A.; Stauber, R.; Zoller, H.; Schmidt, H. H.; Reuner, U.; Hefter, H.; Trocello, J. M.; Houwen, R. H. J.; Ferenci, P.; Stremmel, W.","Efficacy and safety of oral chelators in treatment of patients with wilson disease","Clinical Gastroenterology and Hepatology","","1542-3565","10.1016/j.cgh.2013.03.012","http://ovidsp.ovid.com/ovidweb.cgi?T=JS&CSC=Y&NEWS=N&PAGE=fulltext&D=emed15&AN=369404032 http://sfx.metabib.ch/sfx_locater?sid=OVID:embase&id=pmid:23542331&id=doi:10.1016%2Fj.cgh.2013.03.012&issn=1542-3565&isbn=&volume=11&issue=8&spage=1028&pages=1028-1035&date=2013&title=Clinical+Gastroenterology+and+Hepatology&atitle=Efficacy+and+safety+of+oral+chelators+in+treatment+of+patients+with+wilson+disease&aulast=Weiss&pid=%3Cauthor%3EWeiss+K.H.%3BThurik+F.%3BGotthardt+D.N.%3BSchafer+M.%3BTeufel+U.%3BWiegand+F.%3BMerle+U.%3BFerenci-Foerster+D.%3BMaieron+A.%3BStauber+R.%3BZoller+H.%3BSchmidt+H.H.%3BReuner+U.%3BHefter+H.%3BTrocello+J.M.%3BHouwen+R.H.J.%3BFerenci+P.%3BStremmel+W.%3C%2Fauthor%3E%3CAN%3E369404032%3C%2FAN%3E%3CDT%3EArticle%3C%2FDT%3E","BACKGROUND & AIMS: Wilson disease is a genetic copper storage disorder that causes hepatic and neurologic symptoms. Chelating agents (D-penicillamine, trientine) are used as first-line therapies for symptomatic patients, but there are few data from large cohorts. We assessed the safety of D-penicillamine and trientine therapy and outcomes of patients with Wilson disease. METHODS: We performed a retrospective analysis of data on 380 patients with Wilson disease from tertiary care centers in Germany and Austria, and 25 additional patients from the EUROWILSON registry. Chelator-based treatment regimens were analyzed for their effect on neurologic and hepatic symptoms and for adverse events that led to discontinuation of therapy (Kaplan-Meier estimation; data were collected for a mean of 13.3 y after therapy began). RESULTS: Changes in medication were common, resulting in analysis of 471 chelator monotherapies (326 patients receiving D-penicillamine and 141 receiving trientine). Nine of 326 patients treated with D-penicillamine and 3 of 141 patients given trientine underwent liver transplantation. Adverse events leading to discontinuation of treatment were more frequent among those receiving D-penicillamine than trientine (P = .039). Forty-eight months after therapy, hepatic deterioration was reported in only 4 of 333 patients treated initially with a chelating agent. Hepatic improvements were observed in more than 90%, and neurologic improvements were observed in more than 55%, of therapy-naive patients, and values did not differ significantly between treatments. However, neurologic deterioration was observed less frequently in patients given D-penicillamine first (6 of 295) than those given trientine first (4 of 38; P = .018). CONCLUSIONS: Chelating agents are effective therapies for most patients with Wilson disease; D-penicillamine and trientine produce comparable outcomes, although D-penicillamine had a higher rate of adverse events. Few patients receiving chelation therapy had neurologic deterioration, which occurred more frequently in patients who received trientine. © 2013 AGA Institute.","2013-08","2020-02-20 10:16:14","2020-02-20 10:16:14","","1028-1035","","8","11","","","","","","","","","","English","","","Embase","369404032","Ovid Technologies","","","","","","albuminuria/si [Side Effect]; alopecia/si [Side Effect]; arthralgia/si [Side Effect]; article; atp7b; chelation therapy; drug efficacy; drug fatality/si [Side Effect]; drug safety; drug withdrawal; elastosis/si [Side Effect]; erythema/si [Side Effect]; fatigue/si [Side Effect]; female; follow up; genotype; headache/si [Side Effect]; hematuria/si [Side Effect]; hirsutism/si [Side Effect]; human; kidney disease/si [Side Effect]; leukopenia/si [Side Effect]; liver function; liver transplantation; lupus erythematosus/si [Side Effect]; major clinical study; male; Metabolic disorder; myalgia/si [Side Effect]; nephrotic syndrome/si [Side Effect]; optic neuritis/si [Side Effect]; patient compliance; penicillamine/ae [Adverse Drug Reaction]; penicillamine/dt [Drug Therapy]; penicillamine/po [Oral Drug Administration]; phenotype; polyneuropathy/si [Side Effect]; pruritus/si [Side Effect]; retrospective study; treatment duration; trientine/ae [Adverse Drug Reaction]; trientine/dt [Drug Therapy]; trientine/po [Oral Drug Administration]; Wilson disease/dt [Drug Therapy]; Wilson's disease; Wilsons disease","","","","","","","","","","","","","","","","","","","","","","","","","","","","","","","","","","","","","","","","","","","","","","",""
"G3VIKART","journalArticle","2011","Weiss, K. H.; Gotthardt, D. N.; Klemm, D.; Merle, U.; Ferencifoerster, D.; Schaefer, M.; Ferenci, P.; Stremmel, W.","Zinc monotherapy is not as effective as chelating agents in treatment of Wilson disease","Gastroenterology","","0016-5085","10.1053/j.gastro.2010.12.034","http://ovidsp.ovid.com/ovidweb.cgi?T=JS&CSC=Y&NEWS=N&PAGE=fulltext&D=emed13&AN=361522393 http://sfx.metabib.ch/sfx_locater?sid=OVID:embase&id=pmid:21185835&id=doi:10.1053%2Fj.gastro.2010.12.034&issn=0016-5085&isbn=&volume=140&issue=4&spage=1189&pages=1189-1198&date=2011&title=Gastroenterology&atitle=Zinc+monotherapy+is+not+as+effective+as+chelating+agents+in+treatment+of+Wilson+disease&aulast=Weiss&pid=%3Cauthor%3EWeiss+K.H.%3BGotthardt+D.N.%3BKlemm+D.%3BMerle+U.%3BFerencifoerster+D.%3BSchaefer+M.%3BFerenci+P.%3BStremmel+W.%3C%2Fauthor%3E%3CAN%3E361522393%3C%2FAN%3E%3CDT%3EArticle%3C%2FDT%3E","Background & Aims: Wilson disease is a genetic disorder that affects copper storage, leading to liver failure and neurologic deterioration. Patients are treated with copper chelators and zinc salts, but it is not clear what approach is optimal because there have been few studies of large cohorts. We assessed long-term outcomes of different treatments. Methods: Patients in tertiary care centers were retrospectively analyzed (n = 288; median follow-up time, 17.1 years) for adherence to therapy, survival, treatment failure, and adverse events from different treatment regimens (chelators, zinc, or a combination). Hepatic treatment failure was defined as an increase in activity of liver enzymes (aspartate aminotransferase, alanine aminotransferase, and gamma-glutamyltransferase) >2-fold the upper limit of normal or >100% of baseline with an increase in urinary copper excretion. Results: The median age at onset of Wilson disease was 17.5 years. Hepatic and neuropsychiatric symptoms occurred in 196 (68.1%) and 99 (34.4%) patients, respectively. Hepatic treatment failure occurred more often from zinc therapy (14/88 treatments) than from chelator therapy (4/313 treatments; P < .001). Actuarial survival, without transplantation, showed an advantage for chelating agents (P < .001 vs zinc). Changes in treatment resulted mostly from adverse events, but the frequency did not differ between groups. Patients who did not respond to zinc therapy showed hepatic improvement after reintroduction of a chelating agent. Conclusions: Treatments with chelating agents or zinc salt are effective in most patients with Wilson disease; chelating agents are better at preventing hepatic deterioration. It is important to identify patients who do not respond to zinc therapy and have increased activities of liver enzymes, indicating that a chelating agent should be added to the therapeutic regimen. © 2011 AGA Institute.","2011-04","2020-02-20 10:16:14","2020-02-20 10:16:14","","1189-1198","","4","140","","","","","","","","","","English","","","Embase","361522393","Ovid Technologies","","","","","","adult; alanine aminotransferase blood level; alanine aminotransferase/ec [Endogenous Compound]; article; aspartate aminotransferase blood level; aspartate aminotransferase/ec [Endogenous Compound]; atp7b; chelation therapy; cohort analysis; copper; d-penicillamine; deterioration; drug efficacy; drug treatment failure; drug withdrawal; enzyme activity; female; follow up; gamma glutamyl transferase blood level; gamma glutamyltransferase/ec [Endogenous Compound]; human; liver failure/co [Complication]; major clinical study; male; monotherapy; neurologic disease/co [Complication]; patient compliance; penicillamine/cb [Drug Combination]; penicillamine/dt [Drug Therapy]; priority journal; retrospective study; side effect/si [Side Effect]; survival; treatment outcome; Trientine; trientine/cb [Drug Combination]; trientine/dt [Drug Therapy]; Triethylenetetramine; Wilson disease/dt [Drug Therapy]; zinc/ae [Adverse Drug Reaction]; zinc/cb [Drug Combination]; zinc/dt [Drug Therapy]","","","","","","","","","","","","","","","","","","","","","","","","","","","","","","","","","","","","","","","","","","","","","","",""
"AK4MNQZS","journalArticle","2008","Brewer, G. J.; Askari, F.; Lorincz, M. T.; Carlson, M.; Schilsky, M.; Kluin, K. J.; Hedera, P.; Moretti, P.; Fink, J. K.; Tankanow, R.; Dick, R. B.; Sitterly, J.","Tetrathiomolybdate versus trientine in the initial treatment of neurologic Wilson's disease","Progress in Neurotherapeutics and Neuropsychopharmacology","","1748-2321 1748-233X","10.1017/S1748232107000043","http://ovidsp.ovid.com/ovidweb.cgi?T=JS&CSC=Y&NEWS=N&PAGE=fulltext&D=emed11&AN=351266908 http://sfx.metabib.ch/sfx_locater?sid=OVID:embase&id=pmid:&id=doi:10.1017%2FS1748232107000043&issn=1748-2321&isbn=&volume=3&issue=1&spage=153&pages=153-165&date=2008&title=Progress+in+Neurotherapeutics+and+Neuropsychopharmacology&atitle=Tetrathiomolybdate+versus+trientine+in+the+initial+treatment+of+neurologic+Wilson%27s+disease&aulast=Brewer&pid=%3Cauthor%3EBrewer+G.J.%3BAskari+F.%3BLorincz+M.T.%3BCarlson+M.%3BSchilsky+M.%3BKluin+K.J.%3BHedera+P.%3BMoretti+P.%3BFink+J.K.%3BTankanow+R.%3BDick+R.B.%3BSitterly+J.%3C%2Fauthor%3E%3CAN%3E351266908%3C%2FAN%3E%3CDT%3EArticle%3C%2FDT%3E https://www.cambridge.org/core/journals/progress-in-neurotherapeutics-and-neuropsychopharmacology/article/tetrathiomolybdate-versus-trientine-in-the-initial-treatment-of-neurologic-wilsons-disease/0475F2A9C43F6B6FFABAF9071E7860ED","Background: The initial treatment of the neurologic presentation of Wilson's disease is problematic. Penicillamine, used for years on most patients, causes neurologic worsening in up to half of such patients, and half of those who worsen never recover. Zinc, ideal for maintenance therapy, is too slow for these acutely ill patients. We have developed tetrathiomolybdate (TM) for this type of patient, and it has worked well in open label studies. Trientine, another anticopper drug on the market approved for penicillamine intolerant patients, had not been tried in this type of patient. Here, we report on a double blind trial of TM versus trientine in the neurologically presenting Wilson's disease patient. Design and Methods: The study was a double blind design in which patients received either TM plus zinc, or trientine plus zinc, for 8 weeks* Patients were accepted if they presented with neurologic symptoms from Wilson's disease, if they had not been treated longer than 4 weeks with penicillamine or trientine. Patients were followed in the hospital for the 8 weeks of treatment with weekly semiquantitative neurologic and speech examinations, to evaluate possible neurologic worsening. They also had blood and urine studies done weekly. At discharge from hospital they were continued on zinc maintenance therapy, and returned at yearly intervals for 3 years for further evaluation. Results: Twenty-three patients were entered into the trientine arm and 6 reached criteria for neurologic deterioration, while 25 patients were entered into the TM arm and only 1 deteriorated (p < 0.05). One patient on trientine had an adverse event while 7 on TM had adverse events. All adverse events were mild. Four patients in the trientine arm died during follow-up, 3 having shown initial neurologic deterioration, 2 patients in the TM arm died. In those patients who did not deteriorate or die, neurologic and speech recovery over 3 years was good. Interpretation: TM is a superior choice to trientine for the initial therapy of neurologic Wilson's disease. © 2008 Cambridge University Press.","2008-03","2020-02-20 10:16:15","2020-02-20 10:16:15","","153-165","","1","3","","","","","","","","","","English","","","Embase","351266908","Ovid Technologies","","","","","","alanine aminotransferase blood level; anemia/si [Side Effect]; article; aspartate aminotransferase blood level; clinical article; clinical trial; controlled clinical trial; controlled study; copper blood level; Copper toxicity; disease exacerbation; double blind procedure; Double blind trial; drug choice; drug safety; drug tolerability; fatality; follow up; hospital patient; human; laboratory test; leukopenia/si [Side Effect]; maintenance therapy; Neurologic damage; neurologic examination; penicillamine/dt [Drug Therapy]; priority journal; quantitative analysis; randomized controlled trial; scoring system; side effect/si [Side Effect]; speech and language assessment; Tetrathiomolybdate; tetrathiomolybdic acid/ae [Adverse Drug Reaction]; tetrathiomolybdic acid/cb [Drug Combination]; tetrathiomolybdic acid/cm [Drug Comparison]; tetrathiomolybdic acid/ct [Clinical Trial]; tetrathiomolybdic acid/dt [Drug Therapy]; Trientine; trientine/ae [Adverse Drug Reaction]; trientine/cb [Drug Combination]; trientine/cm [Drug Comparison]; trientine/ct [Clinical Trial]; trientine/dt [Drug Therapy]; Wilson disease/dt [Drug Therapy]; Wilson's disease; zinc/cb [Drug Combination]; zinc/ct [Clinical Trial]; zinc/dt [Drug Therapy]","","","","","","","","","","","","","","","","","","","","","","","","","","","","","","","","","","","","","","","","","","","","","","",""
